{"contract":"lmdj.assembly.v2","contracts":[{"id":"lmdj.project.v5","version":"5.4.0"},{"id":"lmdj.project-bundle.v1","version":"2.0.0"},{"id":"lmdj.soundset.v1","version":"1.1.0"},{"id":"lmdj.soundset-catalog.v1","version":"1.0.0"},{"id":"lmdj.capability.v2","version":"2.0.0"},{"id":"lmdj.assembly.v2","version":"2.0.0"},{"id":"lmdj.error.v1","version":"1.1.0"},{"id":"lmdj.module.v1","version":"1.0.0"},{"id":"lmdj.product-version.v1","version":"1.0.0"},{"id":"lmdj.audio.pcm16-wav.v1","version":"1.0.0"},{"id":"lmdj.slice-points.v1","version":"1.0.0"},{"id":"lmdj.cardputer-transfer.v1","version":"1.0.0"},{"id":"lmdj.audio.stem-pcm16-wav.v1","version":"1.0.0"},{"id":"lmdj.stem-parameters.v1","version":"1.0.0"}],"hosts":[{"id":"core-cli","version":"3.3.14"},{"id":"core-mcp","version":"3.6.1"},{"id":"native-host","version":"3.4.9"},{"id":"cardputer-host","version":"1.0.9"},{"id":"web-runtime-host","version":"4.3.9"},{"id":"creator-web","version":"6.0.0"}],"modules":[{"id":"foundation","version":"0.5.0"},{"id":"authoring-domain","version":"4.4.0"},{"id":"project-io","version":"7.1.0"},{"id":"project-cooker","version":"2.1.0"},{"id":"audio-runtime","version":"5.2.0"},{"id":"provider-sdk","version":"2.3.0"},{"id":"application-facade","version":"6.7.0"},{"id":"web-runtime-platform","version":"5.8.0"}],"product":{"id":"lmdj","version":"2.0.89.0"},"provider_policy":{"allowed_data_classifications":["public"],"allowed_regions":["local"],"granted_permissions":["proof.execute"]},"providers":[{"capabilities":[{"id":"proof.candidate.v2","version":"2.0.0"}],"id":"local.proof.success","model_identity":null,"version":"2.0.4"},{"capabilities":[{"id":"proof.candidate.v2","version":"2.0.0"}],"id":"local.proof.failure","model_identity":null,"version":"2.0.4"},{"capabilities":[{"id":"sample.slice.v1","version":"1.0.0"}],"id":"local.sample.slice","model_identity":null,"version":"1.0.4"},{"capabilities":[{"id":"stem.split.v1","version":"1.0.0"}],"id":"local.proof.stem","model_identity":null,"version":"1.0.0"}]}
